{
  "$schema": "http://json-schema.org/draft-07/schema#",
  "$id": "https://example.com/your-schema#",
  "type": "object",
  "properties": {
    "champion": {
      "type": "string"
    },
    "sanitizedName": {
      "type": "string",
      "enum": [
        "aatrox",
        "ahri",
        "akali",
        "akshan",
        "alistar",
        "amumu",
        "anivia",
        "annie",
        "aphelios",
        "ashe",
        "aurelion-sol",
        "azir",
        "bard",
        "belveth",
        "blitzcrank",
        "brand",
        "braum",
        "briar",
        "caitlyn",
        "camille",
        "cassiopeia",
        "chogath",
        "corki",
        "darius",
        "diana",
        "draven",
        "dr-mundo",
        "ekko",
        "elise",
        "evelynn",
        "ezreal",
        "fiddlesticks",
        "fiora",
        "fizz",
        "galio",
        "gangplank",
        "garen",
        "gnar",
        "gragas",
        "graves",
        "gwen",
        "hecarim",
        "heimerdinger",
        "hwei",
        "illaoi",
        "irelia",
        "ivern",
        "janna",
        "jarvan-iv",
        "jax",
        "jayce",
        "jhin",
        "jinx",
        "kaisa",
        "kalista",
        "karma",
        "karthus",
        "kassadin",
        "katarina",
        "kayle",
        "kayn",
        "kennen",
        "khazix",
        "kindred",
        "kled",
        "kogmaw",
        "ksante",
        "leblanc",
        "lee-sin",
        "leona",
        "lillia",
        "lissandra",
        "lucian",
        "lulu",
        "lux",
        "malphite",
        "malzahar",
        "maokai",
        "master-yi",
        "milio",
        "miss-fortune",
        "mordekaiser",
        "morgana",
        "naafiri",
        "nami",
        "nasus",
        "nautilus",
        "neeko",
        "nidalee",
        "nilah",
        "nocturne",
        "nunu-and-willump",
        "olaf",
        "orianna",
        "ornn",
        "pantheon",
        "poppy",
        "pyke",
        "qiyana",
        "quinn",
        "rakan",
        "rammus",
        "reksai",
        "rell",
        "renata-glasc",
        "renekton",
        "rengar",
        "riven",
        "rumble",
        "ryze",
        "samira",
        "sejuani",
        "senna",
        "seraphine",
        "sett",
        "shaco",
        "shen",
        "shyvana",
        "singed",
        "sion",
        "sivir",
        "skarner",
        "sona",
        "soraka",
        "swain",
        "sylas",
        "syndra",
        "tahm-kench",
        "taliyah",
        "talon",
        "taric",
        "teemo",
        "thresh",
        "tristana",
        "trundle",
        "tryndamere",
        "twisted-fate",
        "twitch",
        "udyr",
        "urgot",
        "varus",
        "vayne",
        "veigar",
        "velkoz",
        "vex",
        "viego",
        "vi",
        "viktor",
        "vladimir",
        "volibear",
        "warwick",
        "wukong",
        "xayah",
        "xerath",
        "xin-zhao",
        "yasuo",
        "yone",
        "yorick",
        "yuumi",
        "zac",
        "zed",
        "zeri",
        "ziggs",
        "zilean",
        "zoe",
        "zyra"
      ]
    },
    "name": {
      "type": "string"
    },
    "buildType": {
      "type": "string",
      "enum": [
        "adc",
        "ad",
        "bruiser",
        "mage",
        "support",
        "tank"
      ]
    },
    "buildCategory": {
      "type": "string",
      "enum": [
        "meta",
        "off-meta",
        "fun"
      ]
    },
    "info": {
      "type": "object",
      "properties": {
        "description": {
          "type": "string"
        },
        "notes": {
          "type": "array",
          "items": {
            "type": "string"
          }
        },
        "how it works": {
          "type": "array",
          "items": {
            "type": "string"
          }
        },
        "how to play": {
          "type": "array",
          "items": {
            "type": "string"
          }
        }
      }
    },
    "summonerSpells": {
      "type": "array",
      "items": {
        "enum": [
          "barrier",
          "clarity",
          "cleanse",
          "exhaust",
          "flash",
          "ghost",
          "mark",
          "heal",
          "ignite"
        ]
      },
      "uniqueItems": true
    },
    "quickSkillOrder": {
      "type": "string"
    },
    "runes": {
      "type": "object",
      "properties": {
        "major": {
          "type": "object",
          "properties": {
            "configuration": {
              "type": "array",
              "items": {
                "type": "string",
                "enum": [
                  "press",
                  "lethal",
                  "fleet",
                  "conqueror",
                  "overheal",
                  "triumph",
                  "presence",
                  "alacrity",
                  "tenacity",
                  "bloodline",
                  "coup",
                  "cut",
                  "last",
                  "electrocute",
                  "predator",
                  "dark",
                  "hail",
                  "cheap",
                  "taste",
                  "sudden",
                  "zombie",
                  "ghost",
                  "eyeball",
                  "treasure",
                  "ingenious",
                  "relentless",
                  "ultimate",
                  "summon",
                  "arcane",
                  "phase",
                  "nullifying",
                  "manaflow",
                  "nimbus",
                  "transcendence",
                  "celerity",
                  "absolute",
                  "scorch",
                  "waterwalking",
                  "gathering",
                  "grasp",
                  "aftershock",
                  "guardian",
                  "demolish",
                  "font",
                  "shield",
                  "conditioning",
                  "second",
                  "bone",
                  "overgrowth",
                  "revitalize",
                  "unflinching",
                  "glacial",
                  "unsealed",
                  "first",
                  "hextech",
                  "magical",
                  "perfect",
                  "futures",
                  "minion",
                  "biscuit",
                  "cosmic",
                  "approach",
                  "time"
                ]
              }
            },
            "tree": {
              "type": "string",
              "enum": [
                "Precision",
                "Domination",
                "Sorcery",
                "Resolve",
                "Inspiration"
              ]
            }
          }
        },
        "minor": {
          "type": "object",
          "properties": {
            "configuration": {
              "type": "array",
              "items": {
                "type": "string",
                "enum": [
                  "press",
                  "lethal",
                  "fleet",
                  "conqueror",
                  "overheal",
                  "triumph",
                  "presence",
                  "alacrity",
                  "tenacity",
                  "bloodline",
                  "coup",
                  "cut",
                  "last",
                  "electrocute",
                  "predator",
                  "dark",
                  "hail",
                  "cheap",
                  "taste",
                  "sudden",
                  "zombie",
                  "ghost",
                  "eyeball",
                  "treasure",
                  "ingenious",
                  "relentless",
                  "ultimate",
                  "summon",
                  "arcane",
                  "phase",
                  "nullifying",
                  "manaflow",
                  "nimbus",
                  "transcendence",
                  "celerity",
                  "absolute",
                  "scorch",
                  "waterwalking",
                  "gathering",
                  "grasp",
                  "aftershock",
                  "guardian",
                  "demolish",
                  "font",
                  "shield",
                  "conditioning",
                  "second",
                  "bone",
                  "overgrowth",
                  "revitalize",
                  "unflinching",
                  "glacial",
                  "unsealed",
                  "first",
                  "hextech",
                  "magical",
                  "perfect",
                  "futures",
                  "minion",
                  "biscuit",
                  "cosmic",
                  "approach",
                  "time"
                ]
              }
            },
            "tree": {
              "type": "string",
              "enum": [
                "Precision",
                "Domination",
                "Sorcery",
                "Resolve",
                "Inspiration"
              ]
            }
          }
        },
        "passive": {
          "type": "object",
          "properties": {
            "configuration": {
              "type": "array",
              "items": [
                {
                  "enum": [
                    "adaptive",
                    "as",
                    "haste"
                  ]
                },
                {
                  "enum": [
                    "adaptive",
                    "armor",
                    "mr"
                  ]
                },
                {
                  "enum": [
                    "hp",
                    "armor",
                    "mr"
                  ]
                }
              ],
              "minItems": 3,
              "maxItems": 3
            },
            "tree": {
              "type": "string",
              "enum": [
                "Passive"
              ]
            }
          }
        }
      }
    },
    "itemSets": {
      "type": "array",
      "items": {
        "type": "object",
        "properties": {
          "description": {
            "type": "string"
          },
          "items": {
            "type": "array",
            "items": {
              "type": "string",
              "enum": [
                "Abyssal Mask",
                "Aegis of the Legion",
                "Aether Wisp",
                "Amplifying Tome",
                "Anathema's Chains",
                "Anti-tower Socks",
                "Archangel's Staff",
                "Ardent Censer",
                "Axiom Arc",
                "Bami's Cinder",
                "Bandleglass Mirror",
                "Banshee's Veil",
                "Berserker's Greaves",
                "B. F. Sword",
                "Black Cleaver",
                "Black Mist Scythe",
                "Blade of The Ruined King",
                "Blasting Wand",
                "Blighting Jewel",
                "Bloodthirster",
                "Bloodward",
                "Boots",
                "Boots of Swiftness",
                "Bramble Vest",
                "Broken Stopwatch",
                "Bulwark of the Mountain",
                "Caesura",
                "Catalyst of Aeons",
                "Caulfield's Warhammer",
                "Ceaseless Hunger",
                "Chain Vest",
                "Chempunk Chainsword",
                "Chemtech Putrifier",
                "Cloak of Agility",
                "Cloth Armor",
                "Commencing Stopwatch",
                "Control Ward",
                "Corrupting Potion",
                "Cosmic Drive",
                "Crown of the Shattered Queen",
                "Crystalline Bracer",
                "Cull",
                "Dagger",
                "Dark Seal",
                "Dead Man's Plate",
                "Death's Dance",
                "Death's Daughter500 Silver Serpents",
                "Deicide",
                "Demonic Embrace",
                "Divine Sunderer",
                "Doran's Blade",
                "Doran's Ring",
                "Doran's Shield",
                "Draktharr's Shadowcarver",
                "Dreamshatter",
                "Duskblade of Draktharr",
                "Eclipse",
                "Edge of Night",
                "Elixir of Iron",
                "Elixir of Sorcery",
                "Elixir of Wrath",
                "Emberknife",
                "Equinox",
                "Essence Reaver",
                "Eternal Winter",
                "Evenshroud",
                "Everfrost",
                "Executioner's Calling",
                "Eye of Luden",
                "Eye of the Herald",
                "Faerie Charm",
                "Farsight Alteration",
                "Fiendish Codex",
                "Fimbulwinter",
                "Fire at Will500 Silver Serpents",
                "Forbidden Idol",
                "Force of Nature",
                "Fortification",
                "Frostfang",
                "Frozen Fist",
                "Frozen Heart",
                "Galeforce",
                "Gangplank Placeholder",
                "Gargoyle Stoneplate",
                "Giant's Belt",
                "Glacial Buckler",
                "Goredrinker",
                "Guardian Angel",
                "Guardian's Blade",
                "Guardian's Hammer",
                "Guardian's Horn",
                "Guardian's Orb",
                "Guinsoo's Rageblade",
                "Gusto",
                "Gustwalker Hatchling",
                "Hailblade",
                "Harrowing Crescent",
                "Health Potion",
                "Hearthbound Axe",
                "Heartsteel",
                "Hexdrinker",
                "Hextech Alternator",
                "Hextech Rocketbelt",
                "Horizon Focus",
                "Hullbreaker",
                "Icathia's Curse",
                "Iceborn Gauntlet",
                "Immortal Shieldbow",
                "Imperial Mandate",
                "Infinite Convergence",
                "Infinity Edge",
                "Infinity Force",
                "Echoes of Helia",
                "Ionian Boots of Lucidity",
                "Ironspike Whip",
                "Jak'Sho, The Protean",
                "Kalista's Black Spear",
                "Kindlegem",
                "Kircheis Shard",
                "Knight's Vow",
                "Kraken Slayer",
                "Last Whisper",
                "Leeching Leer",
                "Leviathan",
                "Liandry's Anguish",
                "Liandry's Lament",
                "Lich Bane",
                "Lightning Rod",
                "Locket of the Iron Solari",
                "Long Sword",
                "Lord Dominik's Regards",
                "Lost Chapter",
                "Luden's Tempest",
                "Manamune",
                "Maw of Malmortius",
                "Mejai's Soulstealer",
                "Mercurial Scimitar",
                "Mercury's Treads",
                "Mikael's Blessing",
                "Minion Dematerializer",
                "Mobility Boots",
                "Moonstone Renewer",
                "Morellonomicon",
                "Mortal Reminder",
                "Mosstomper Seedling",
                "Muramana",
                "Nashor's Tooth",
                "Navori Quickblades",
                "Needlessly Large Rod",
                "Negatron Cloak",
                "Night Harvester",
                "Noonquiver",
                "Null-Magic Mantle",
                "Oblivion Orb",
                "Obsidian Edge",
                "Oracle Lens",
                "Overcharged",
                "OvererchargedHA",
                "Pauldrons of Whiterock",
                "Penetrating Bullets",
                "Perfectly Timed Stopwatch",
                "Phage",
                "Phantom Dancer",
                "Phreakish Gusto",
                "Pickaxe",
                "Plated Steelcaps",
                "Poro-Snax",
                "Primordial Dawn",
                "Prowler's Claw",
                "Quicksilver Sash",
                "Rabadon's Deathcap",
                "Radiant Virtue",
                "Rageknife",
                "Raise Morale500 Silver Serpents",
                "Randuin's Omen",
                "Rapid Firecannon",
                "Ravenous Hydra",
                "Recurve Bow",
                "Redemption",
                "Refillable Potion",
                "Reinforced Armor",
                "Rejuvenation Bead",
                "Relic Shield",
                "Reliquary of the Golden Dawn",
                "Riftmaker",
                "Rod of Ages",
                "Ruby Crystal",
                "Runaan's Hurricane",
                "Runesteel Spaulders",
                "Rylai's Crystal Scepter",
                "Sandshrike's Claw",
                "Sapphire Crystal",
                "Scarecrow Effigy",
                "Scorchclaw Pup",
                "Seat of Command",
                "Seeker's Armguard",
                "Seraph's Embrace",
                "Serpent's Fang",
                "Serrated Dirk",
                "Serylda's Grudge",
                "Shadowflame",
                "Shard of True Ice",
                "Sheen",
                "Shurelya's Battlesong",
                "Shurelya's Requiem",
                "Silvermere Dawn",
                "Slightly Magical Footwear",
                "Sorcerer's Shoes",
                "Spear of Shojin",
                "Spectral Sickle",
                "Spectre's Cowl",
                "Spellthief's Edge",
                "Spirit Visage",
                "Staff of Flowing Water",
                "Starcaster",
                "Stealth Ward",
                "Steel Shoulderguards",
                "Sterak's Gage",
                "Stirring Wardstone",
                "Stopwatch",
                "Stormrazor",
                "Stridebreaker",
                "Statikk Shiv",
                "Structure Bounty",
                "Sunfire Aegis",
                "Super Mech Armor",
                "Super Mech Power Field",
                "Syzygy",
                "Targon's Buckler",
                "Tear of the Goddess",
                "The Collector",
                "The Golden Spatula",
                "The Unspoken Parasite",
                "Thornmail",
                "Tiamat",
                "Titanic Hydra",
                "Total Biscuit of Everlasting Will",
                "Tower Power-Up",
                "Trinity Force",
                "Turbo Chemtank",
                "Turret Plating",
                "Typhoon",
                "Umbral Glaive",
                "Upgraded Aeropack",
                "Vampiric Scepter",
                "Vanguard",
                "Verdant Barrier",
                "Vespertide",
                "Vigilant Wardstone",
                "Void Staff",
                "Warden's Eye",
                "Warden's Mail",
                "Warmog's Armor",
                "Watchful Wardstone",
                "Winged Moonplate",
                "Winter's Approach",
                "Wit's End",
                "Wyrmfallen Sacrifice",
                "Youmuu's Ghostblade",
                "Your Cut",
                "Zeal",
                "Zeke's Convergence",
                "Zhonya's Hourglass"
              ]
            }
          }
        }
      }
    }
  },
  "required": [
    "champion",
    "sanitizedName",
    "name",
    "buildType",
    "buildCategory",
    "info",
    "summonerSpells",
    "quickSkillOrder",
    "runes",
    "itemSets"
  ]
}
